{
  "$schema": "https://json-schema.org/draft/2020-12/schema",
  "$id": "https://tv-automation.local/schemas/entities/strategy-instance-v1.schema.json",
  "title": "DeskStrategyInstance",
  "type": "object",
  "additionalProperties": false,
  "required": [
    "schema_version",
    "strategy_instance_id",
    "strategy_version_id",
    "runtime_state",
    "execution_mode",
    "triple_lock_validated",
    "created_at"
  ],
  "properties": {
    "schema_version": { "const": "strategy_instance_v1" },
    "strategy_instance_id": {
      "type": "string",
      "pattern": "^[0-9a-fA-F]{8}-[0-9a-fA-F]{4}-[1-5][0-9a-fA-F]{3}-[89abAB][0-9a-fA-F]{3}-[0-9a-fA-F]{12}$"
    },
    "strategy_version_id": {
      "type": "string",
      "pattern": "^[0-9a-fA-F]{8}-[0-9a-fA-F]{4}-[1-5][0-9a-fA-F]{3}-[89abAB][0-9a-fA-F]{3}-[0-9a-fA-F]{12}$"
    },
    "runtime_state": {
      "type": "string",
      "enum": ["CREATED", "STARTING", "RUNNING", "PAUSED", "STOPPING", "STOPPED", "FAILED_TO_START", "ERRORED"]
    },
    "execution_mode": {
      "type": "string",
      "enum": ["SHADOW", "PAPER", "LIVE"]
    },
    "account_scope": { "type": ["string", "null"], "maxLength": 180 },
    "instrument_scope": {
      "type": "array",
      "items": { "type": "string", "minLength": 1, "maxLength": 32 },
      "uniqueItems": true
    },
    "session_scope": {
      "type": "array",
      "items": { "type": "string", "minLength": 1, "maxLength": 80 },
      "uniqueItems": true
    },
    "risk_budget_ref": {
      "type": ["string", "null"],
      "pattern": "^[0-9a-fA-F]{8}-[0-9a-fA-F]{4}-[1-5][0-9a-fA-F]{3}-[89abAB][0-9a-fA-F]{3}-[0-9a-fA-F]{12}$"
    },
    "triple_lock_validated": { "type": "boolean" },
    "operator_approval_id": { "type": ["string", "null"], "maxLength": 180 },
    "metadata": { "type": "object", "additionalProperties": true },
    "created_at": { "type": "string", "format": "date-time" },
    "updated_at": { "type": ["string", "null"], "format": "date-time" },
    "last_heartbeat_at": { "type": ["string", "null"], "format": "date-time" },
    "started_at": { "type": ["string", "null"], "format": "date-time" },
    "stopped_at": { "type": ["string", "null"], "format": "date-time" },
    "failed_at": { "type": ["string", "null"], "format": "date-time" }
  }
}
