{
  "schema_version": "strategy_instance_v1",
  "strategy_instance_id": "d4e5f6a7-8b9c-4d1e-9f2a-3b4c5d6e7f80",
  "strategy_version_id": "3b2f1a90-6e3d-4b8e-9d1a-2f6c8e0a9b11",
  "runtime_state": "RUNNING",
  "execution_mode": "PAPER",
  "account_scope": "paper-sim-001",
  "instrument_scope": ["MNQ", "MES"],
  "session_scope": ["ny_open"],
  "risk_budget_ref": null,
  "triple_lock_validated": false,
  "operator_approval_id": null,
  "metadata": {
    "lane": "paper"
  },
  "created_at": "2026-08-07T09:20:00.000Z",
  "started_at": "2026-08-07T09:21:00.000Z",
  "last_heartbeat_at": "2026-08-07T09:22:00.000Z"
}
